Sentence ID,Biased Sentences,Sources,Toxicity,T-A Combination
25582633,台灣人站起來喔，不能被外省權貴糟蹋，台灣民主保衛戰，投錯人就準備被統一了,PTT,0,"[('外省', '統一'), ('外省', '權貴')]"
2449844,外省加分仔，跟多元入學有87%像,PTT,1,"[('外省', '加分')]"
7170532,憑身分加分，跟外省加分有什麼差別,PTT,0,"[('外省', '加分')]"
17389719,連偵辦追訴都不用？外省權貴真是特權享好享滿！,PTT,0,"[('外省', '特權'), ('外省', '權貴')]"
9651688,逃難來的外省人就是自以為是,PTT,1,"[('外省人', '自以為是'), ('外省人', '逃難')]"
10672181,高級外省人逃難來台看到什麼都用搶的，現在後代子孫又嘴台灣資源不輸送中國，噁心,PTT,1,"[('外省人', '逃難'), ('外省人', '高級')]"
29834238,那什麼是台灣人？難道是你這個逃難的外省人後代？,PTT,0,"[('外省人', '逃難')]"
33813980,就垃圾外省18%啃老族,PTT,1,"[('外省', '18')]"
31855465,老伯可能是外省老兵之類的，腦袋只有黨國，沒有是非,PTT,1,"[('老兵', '黨國'), ('外省', '黨國')]"