Sentence ID,Biased Sentences,Sources,Toxicity,T-A Combination
10226517,我講話就是理工男人不懂修飾,PTT,0,"[('男人', '理工')]"
10226545,犯了天下理工男人都會犯的錯,PTT,0,"[('男人', '理工')]"
26835592,球都給你了，是男人的就要大膽的現出來！,PTT,0,"[('男人', '大膽')]"
29806542,把男生請吃飯講得理所當然,PTT,0,"[('男生', '請吃飯')]"
10448993,警察叔叔就是這個人硬要牽我的手,PTT,0,"[('叔叔', '警察')]"
11156000,男性比較強壯，要扛保家衛國的責任,PTT,0,"[('男性', '責任'), ('男性', '壯')]"
17376163,理工處男比較夯,PTT,0,"[('處男', '理工')]"
14541597,理工大概一個班有9成都處男,PTT,0,"[('處男', '理工')]"
11405282,什麼叫不要製造後代，台男取外配就是要買子宮傳宗接代的，不生的話那還娶幹嘛,PTT,1,"[('台男', '傳宗接代'), ('台男', '台男')]"
29657840,理組身邊都男生,PTT,0,"[('男生', '理組')]"
11628070,處男比較噁，有處男臭,PTT,1,"[('處男', '噁'), ('處男', '臭')]"
12460074,噁台男又在犯賤了,PTT,1,"[('台男', '噁'), ('台男', '犯賤'), ('台男', '台男')]"
20885432,是男人就果斷好嗎,PTT,0,"[('男人', '果斷')]"
13936832,男森就要喜歡陽剛一點的東西,PTT,0,"[('男森', '陽剛')]"
17233672,理科男人,PTT,0,"[('男人', '理科')]"
17255637,臺男素質，這一定是理組,PTT,0,"[('臺男', '理組')]"
16045256,誰知道被台男請客下次會不會被砍,PTT,1,"[('台男', '請客'), ('台男', '台男')]"
19133589,年薪最高的男人竟然沒來請客,PTT,0,"[('男人', '請客')]"
20980320,台男連當消防員都能騷擾人，厲害了台男,PTT,0,"[('台男', '消防員'), ('台男', '台男')]"
21273235,注重外表的男性都很娘,PTT,1,"[('男性', '娘')]"
21722459,男生留鬢角? 噁 幹嘛弄得像日本娘炮?,PTT,1,"[('男生', '噁'), ('男生', '娘'), ('男生', '娘炮')]"
21846635,從小到大的教育就是男人就該喜歡陽剛的東西,PTT,0,"[('男人', '陽剛')]"
21988921,話說男生如果其他方面夠耀眼是可以蓋過身高這個硬傷的，可惜那位學弟明顯不是哈哈哈,PTT,0,"[('學弟', '身高')]"
22471134,根據優生學理組就一群臭宅男 讓人類滅亡,PTT,1,"[('宅男', '臭'), ('宅男', '理組')]"
22615335,想跟警察說是男人就去抓小偷，別只會開罰單,PTT,0,"[('男人', '警察')]"
23574645,男人的確有時候就是犯賤,PTT,1,"[('男人', '犯賤')]"
23672706,最帥的男人，成大事不拘小節,PTT,0,"[('男人', '帥'), ('男人', '不拘小節')]"
24554099,警察叔叔就是他們,PTT,0,"[('叔叔', '警察')]"
26132185,台男不管老醜窮一樣外遇，所以選有錢帥的才聰明,PTT,0,"[('台男', '帥'), ('台男', '有錢'), ('台男', '聰明'), ('台男', '醜'), ('台男', '台男')]"
26185129,絕大部分是理工宅男處男,PTT,0,"[('處男', '理工'), ('宅男', '理工')]"
26191953,男人就應該喜歡有男子氣概的東西,PTT,0,"[('男人', None)]"
34257466,台男就一堆賤畜種豬阿,PTT,1,"[('台男', '台男')]"
30671621,男生腿太細會有娘味,PTT,0,"[('男生', '娘')]"
28753728,專業的男人最帥,PTT,0,"[('男人', '帥'), ('男人', '專業')]"
31923801,不會注意到那麼多細節，只覺得男人穿西裝很帥,PTT,0,"[('男人', '西裝'), ('男人', '帥')]"
29195928,男生就是要不拘小節,PTT,0,"[('男生', '不拘小節')]"
29672248,台男悲歌這種穿著跟這凌亂的髮型一看就知道是臭宅男,PTT,1,"[('宅男', '臭'), ('台男', '臭'), ('台男', '台男')]"
29828496,如果男生不帥就麻煩認份點,PTT,0,"[('男生', '帥')]"
29852045,男生尖叫啥小  娘炮,PTT,1,"[('男生', '娘炮')]"
30689108,宅男講的屁話我還嫌臭勒  回家刷刷牙吧死宅男,PTT,1,"[('宅男', '臭')]"
30975718,男孩子 堅強一點,PTT,0,"[('男孩', '堅強')]"
31652687,聰明的男人真帥,PTT,0,"[('男人', '帥'), ('男人', '聰明')]"
33371207,是男人就勇敢面對，別賴給別人,PTT,0,"[('男人', '勇敢')]"
33683207,果斷、勇敢，台男需要這種,PTT,0,"[('台男', '勇敢'), ('台男', '果斷'), ('台男', '台男')]"
33814600,台男噁心不修邊幅自以為陽剛，嘲笑會打理的男性是娘砲,PTT,1,"[('男性', '娘'),('台男', '噁'), ('台男', '娘'), ('台男', '陽剛'), ('台男', '台男')]"
33814626,衣服穿到臭酸荷葉邊還要硬穿的台男,PTT,1,"[('台男', '臭'), ('台男', '台男')]"
33841141,"開車和運動能力正相關,反應，視野、方向感、操作能力距離判斷都是男性較佳",PTT,0,"[('男性', '方向感')]"
35308464,喜歡男人坦率,PTT,0,"[('男人', '坦率')]"
35743633,男人在外頭玩玩不算什麼,PTT,0,"[('男人', '玩')]"
36168729,我覺得男生就該好好當兵,PTT,0,"[('男生', '當兵')]"
36224319,他們男人強壯勇敢,PTT,0,"[('男人', '勇敢'), ('男人', '壯')]"
36759987,帥哥不夠持久,PTT,0,"[('帥哥', '持久')]"